source,keyword,title,category,up_datetime,content,url
Udn,藻礁,圖表看時事／1218四大公投決戰 一圖秒懂公投主張及提案重點,文教,2021-10-27 16:47:41,受到新冠肺炎疫情影響，原訂於8月28日舉辦的「重啟核四」、「反萊豬進口」、「公投綁大選」、「珍愛藻礁」等四項公投案，因而延至12月18日舉辦投票。《聯合新聞網》整理四大公投案主張及提案重點，讓您一次看懂公投內容。▌重啟核四主　文／「您是否同意核四啟封商轉發電？」提案人／擁核能流言終結者創辦人黃士修領銜理　由／2018年「以核養綠」公投通過，全國絕對多數民意否決政府的非核家園政策，蔡政府仍一意孤行，擁核團體發起重啟核四公投。行政院長蘇貞昌以核廢料無法處理、核四重啟須耗時6至7年為由，封殺核電，實為誤導民眾。黃士修指出，使用過的核燃料97%仍是可利用的能源，而且美國曾表達有意移轉核廢處理技術，並非「不能被處理」；另依前核四廠長王伯輝投書內容，核四重啟應可在2至3年內達成商轉。反核人士宣稱，核四有活動斷層，違反美國NRC法規。然而，根據中央地質調查所《核能電廠的區域地質概況》，核四地質區未發現活動斷層，廠址周遭的澳底斷層、貢寮斷層、枋腳斷層與屈尺斷層等，80萬年以來，已不屬於活動斷層；美國NRC前官員也曾於2018年來台澄清，反核團體所謂的「廠房S斷層」問題，並非事實。政府開放萊豬進口遭質疑黑箱作業，國民黨領銜提案反萊豬公投。聯合報系資料照▌反萊豬進口主　文／「你是否同意政府應全面禁止進口含有瘦肉精（萊克多巴胺等乙型受體素）豬隻之肉品、內臟及其相關產製品？」提案人／國民黨立委林為洲領銜理　由／政府宣布自2021年元旦開放含萊克多巴胺的美國豬肉進口，決策過程不夠公開透明，形同黑箱，透過「行政命令」方式刻意迴避立法院監督。豬肉為國人最主要肉品來源，食用範圍包含豬隻內臟，國際組織《CODEX》雖訂有萊克多巴胺的殘留標準，但受試者僅6人，且未針對孩童、老人、心血管疾病患者等高風險族群測試，標準未必適用於國人。並且，根據研究指出，人體攝食過量的萊克多巴胺會造成心悸、嘔吐、頭暈、血壓升高等不適症狀，萊劑經加熱後也不易被破壞，長期攝食是否危害健康仍存爭議。2018年的九合一大選合併10項公投案。聯合報系資料照▌公投綁大選主　文／「你是否同意公民投票案公告成立後一個月起至六個月內，若該期間內有全國性選舉時，公民投票應與該選舉同日舉行？」提案人／國民黨立委江啟臣領銜理　由／現行法「專設公投日」會降低投票率，過低的投票率，即便公投勉強過關，結果亦缺乏代表性，不符民主正當性；另在行政成本方面，以2018年與九合一大選合併辦理為例，若單獨辦理公投，成本差距將暴增六倍，對人民、政府、公民團體而言是三輸的狀況。「公投綁大選」原本就是民進黨的重要主張，但在2018年公投大敗後，挾執政優勢於2019年6月修正通過《公民投票法》，規定每2年才能舉辦一次公投，並錯開選舉年，此舉將降低公投的投票率，讓公投難以通過。是故，在此訴求依民進黨2017年提出的《公民投票法》修正案，復原《公投法》第23條，要求公投「應」綁大選，提醒民進黨「莫忘初衷」。圖為大潭藻礁與施工中的中油天然氣第三接收站。圖／資料照片▌珍愛藻礁主　文／「您是否同意中油第三天然氣接收站遷離桃園大潭藻礁海岸及海域？」提案人／潘忠政領銜理　由／桃園藻礁是全球最獨特的大型淺海現生藻礁地景及生態系，其中歷經至少7000年才形成的大潭礁尤為珍貴，在大潭藻礁發現的24種造礁藻類，其中有19種是世界新種，且藻礁具固碳功能，可減緩地方暖化，更顯其珍稀度。中油公司於2017年計畫在大潭藻礁建蓋第三天然氣接收站（簡稱三接）的工業港，建蓋範圍將覆蓋大潭藻礁約230公頃的藻礁面積，直接衝擊大潭藻礁生態發展；又因突堤效應，也將連帶影響到鄰近的白玉藻礁和觀新藻礁，造成泥沙淤積。環團認為三接將永久破壞生態，因而基於藻礁保育、能源轉型、氣候變遷、文化保存、公共安全、國防安全、國際形象、法治落實、深化民主等九大理由，訴求全民公投搶救藻礁。公投要如何才算通過？根據公投法第29條規定，只需有效同意票達投票權人總額四分之一，且有效同意票超過不同意票，就算公投通過。以2018年的公投綁大選為例，據中選會估算，總投票人數約1980萬，代表有效同意票要達到495萬票以上，才算通過。公投通過後會發生什麼事？據公投法第30條規定，一旦公投過關，有關法律、自治條例的複決案，原法律或自治條例在公告之日算至第3日起，就會失效；有關法律、自治條例立法原則的創制案，行政院、直轄市、縣（市）政府應於三個月內研擬相關法律，並送立法院、議會審議，應於下一會期休會前完成審議。另外，如果是有關重大政策的公投，應由總統或權責機關為實現該公投案內容做出「必要處置」。政府可以不履行公投結果嗎？政府如果沒有履行公投結果，並沒有罰則，但不論是否履行，民主社會政治人物仍應向民意負責，民意也會在下次選舉反映在選票上。年底12月4項公投齊登場，行政院長蘇貞昌之前曾表示，公投案如果通過，當然要尊重公投結果。至於有沒有人要負政治責任？蘇貞昌回應，「公投的結果對政治人物的政治衝擊會有」，但過去公投案很多，這次也很多，不是公投案有過、沒過，就追究政治責任。公投重要日程記起來‧ 7月2日 發布改定投票日期公告‧ 8月8日 投票權人名冊編造完成‧ 11月8日 公告投票所設置地點‧ 11月13日至12月11日 辦理公民投票案意見發表會或辯論會‧ 12月14日前 公告投票權人人數‧ 12月18日 投票、開票‧ 12月24日前 審定公民投票結果‧ 12月24日 公告公民投票結果【文教熱話題】 ▪ 青少年的網路世界：「數位原生世代」問卷填答 快來分享你的看法！ ▪ 整理包／112年升大學分科測驗 7科完整試題與解答 ▪ 分科測驗／紅利不再！補教估台大醫284級分 缺額校系可這樣選填 ▪ 分科化學／考生嘆不易！非選題計算多 高中師指「這1題」有爭議 ▪ 分科數甲／計算量大、考斜橢圓「好生疏」 考生：很多人寫不完 ▪ 分科生物／COVID-19、猴痘時事入題 考生提早交卷：簡單 ▪ 分科歷史／中國史比重多、考白色恐怖 考生：有刷考古題能拿分 ▪ 分科公民／NCC換照、ME TOO都入題 考生作答想好久直呼「好難」 ▪ 白飯之亂 北科大挨轟「教育失敗」遭洗版剩1.5顆星 ▪ 專題／學習歷程，別鬧了！首屆108課綱生心路大公開 公投萊豬核四藻礁,https://udn.com/news/story/6904/5846838
Udn,藻礁,台灣海域生態大調查 在珊瑚礁區發現「魚類合唱」！,生活,2021-09-23 16:52:14,海洋保育署鎖定全台15處海保區生態熱點啟動首次台灣海域生態大調查，研究團隊9月前完成兩趟環島船舶調查及50處珊瑚礁區潛水生態調查、潮境保護區及觀新藻礁保護區水下聲學生態監測，發現台灣海峽北部海洋魚類物種數多達230種，居全台之最，也在珊瑚礁區觀測到魚類合唱行為！海保署攜手台大海洋中心及農委會水產試驗所調查台灣海域生態，範圍涵蓋台灣3海浬內的沿近岸海域，含桃園大潭藻礁等15處海保區。借助水試所專業，蒐集海域基礎環境參數、浮游動植物、仔稚魚等環境與漁業生態資料；並由台大海研所提供環境DNA、人工智慧、影像自動辨識等新興技術協助監測海洋生物多樣性及微塑膠的變化；同時協助原子能委員會收集重點測站的海水樣本，檢測輻射背景值。研究團隊運用環境DNA方法檢測海洋魚類物種，發現台灣海峽北部物種遠高於東部、南部及西南海域，台灣海峽各樣本分析站以鰺科魚類最多，共偵測到16種，其他海域樣站以燈籠魚科居多，有19種。澎湖南方四島國家公園範圍內的珊瑚礁，以南鐵砧的底棲群聚及魚群最為繁盛。研究團隊也在潮境保護區收錄到大量甲殼類動物聲音及珊瑚礁魚類合唱行為，調查期間剛好是疫情3級警戒，無明顯的人為噪音，後續可藉此比對不同時期的聲學特徵，了解人為活動對海洋生物出沒變化的影響。海保署副署長吳龍靜說，搜羅基礎資料有助了解海洋環境變動，海保署將定期盤點海域生態，擬出適度的保育策略。相關調查資料會上傳海保署海洋保育網、科技部海洋學門資料庫等公開網頁。海保署啟動首度海域生態大調查，先期成果近日出爐。圖／海保署提供海保署攜手台大海研所及農委會水產試驗中心，啟動首度海域生態大調查。圖／海保署提供 珊瑚保護區55Playback speed1x NormalBack0.25x0.5x1x Normal1.5x2x00:00/04:15SkipAds by 想看可愛萌寵、寵物健康保健資訊、教養方法、帶牠們去哪吃喝玩樂，快來加入寵物部落粉絲團！點我前往：https://www.facebook.com/udnpet,https://udn.com/news/story/7470/5766475
Udn,藻礁,台灣海域生態大調查 在珊瑚礁區發現「魚類合唱」！,udn寵物部落,2021-09-23 16:52:14,海洋保育署鎖定全台15處海保區生態熱點啟動首次台灣海域生態大調查，研究團隊9月前完成兩趟環島船舶調查及50處珊瑚礁區潛水生態調查、潮境保護區及觀新藻礁保護區水下聲學生態監測，發現台灣海峽北部海洋魚類物種數多達230種，居全台之最，也在珊瑚礁區觀測到魚類合唱行為！   海保署攜手台大海洋中心及農委會水產試驗所調查台灣海域生態，範圍涵蓋台灣3海浬內的沿近岸海域，含桃園大潭藻礁等15處海保區。借助水試所專業，蒐集海域基礎環境參數、浮游動植物、仔稚魚等環境與漁業生態資料；並由台大海研所提供環境DNA、人工智慧、影像自動辨識等新興技術協助監測海洋生物多樣性及微塑膠的變化；同時協助原子能委員會收集重點測站的海水樣本，檢測輻射背景值。   研究團隊運用環境DNA方法檢測海洋魚類物種，發現台灣海峽北部物種遠高於東部、南部及西南海域，台灣海峽各樣本分析站以鰺科魚類最多，共偵測到16種，其他海域樣站以燈籠魚科居多，有19種。澎湖南方四島國家公園範圍內的珊瑚礁，以南鐵砧的底棲群聚及魚群最為繁盛。   研究團隊也在潮境保護區收錄到大量甲殼類動物聲音及珊瑚礁魚類合唱行為，調查期間剛好是疫情3級警戒，無明顯的人為噪音，後續可藉此比對不同時期的聲學特徵，了解人為活動對海洋生物出沒變化的影響。   海保署副署長吳龍靜說，搜羅基礎資料有助了解海洋環境變動，海保署將定期盤點海域生態，擬出適度的保育策略。相關調查資料會上傳海保署海洋保育網、科技部海洋學門資料庫等公開網頁。海保署啟動首度海域生態大調查，先期成果近日出爐。圖／海保署提供海保署攜手台大海研所及農委會水產試驗中心，啟動首度海域生態大調查。圖／海保署提供 魚類海洋生物  😲 消毒耳機用紫外線燈「會壞嗎」？內行人2清潔招數不讓人生那麼累   想看可愛萌寵、寵物健康保健資訊、教養方法、帶牠們去哪吃喝玩樂，快來加入寵物部落粉絲團！點我前往：https://www.facebook.com/udnpet,https://pets.udn.com/pets/story/122674/5766475
Udn,藻礁,第五屆全球華文永續報導獎 聯合報系六項專題入圍,陽光行動,2021-08-18 16:29:11,Content not found,https://sdgs.udn.com/sdgs/story/13016/5682810
Udn,藻礁,林益仁／人類究竟何去何從？《巫師與先知》推薦序,琅琅悅讀,2021-08-09 15:00:02,地球氣候驟變，環境資源有限，面對明日世界的生態挑戰，你是「先知」，還是「巫師」？  《巫師與先知》本書作者查爾斯．曼恩藉著生動的比喻，刻畫兩種面對生態危機的聲音。一種是「先知」，認為我們應該要「減量再減量，免得人類與自然兩敗俱傷！」先知的觀點正是今日環保節能主義的濫觴。另一種聲音則來自「巫師」，主張我們應該要「創新再創新，設法使人類與自然雙贏！」巫師們的聲音也是現在綠色科技、綠色能源的代言人。同時他發揮記者精神及作家的本領，交織出這個既迫切，又讓各方人馬爭得面紅耳赤的環境論戰史。在這本書裡，我們將會看到各種因應生態危機的對策和主張，希望讀者可在閱讀這本書後，思考自己該如何回答每一個生態議題，同時也思考人類的明天究竟該何去何從。（編按）    文／林益仁（臺北醫學大學醫學人文研究所副教授）  我很喜歡查爾斯．曼恩（Charles C. Mann）的文字。主要的原因是，他的行文之間充滿了一種跨域導讀的知識深度與樂趣，不管是從科學啟導人文，或是從人文反思科學的題材，他總是能處理得相當到位。其次是，他撰寫的主題剛好是我長期研究的課題，也就是貫穿於自然、社會、文化與歷史的生態文明發展的思維。他是一位撰寫科普文類的資深作者，也是重量級的《科學》（Science）學術期刊特約記者。不久前， 衛城出版的編輯希望我為他二〇一八年出版的書《巫師與先知》寫推薦文。能夠介紹心儀作者的中文版譯書，我當然是義不容辭，當然也因為之前曾寫過他《一四九三》與《一四九一》兩書中文導讀的緣分。   在這本書中，曼恩以威廉．佛格特（William Vogt）和諾曼．布勞格（Norman Borlaug）這兩位美國科學家兼社會倡議者為主角，再度運用引人入勝的文筆展開他細膩的人文考察與生態反思。在自然中， 人類這個物種究竟何去何從？以及這個物種所牽動的普世影響，例如當今熱議的「人類世」主題，究竟人們又該如何看待？這一直是他寫作的主軸。不同的是，在《一四九三》與《一四九一》中，他所關切的是由歐洲崛起的現代文明與衝擊，也就是「人類世」的可能起源，然而在本書中，他則是處理在二十世紀開端，初瞥「人類世」後果的兩種回應之間的衝突與對話。針對這兩種截然不同的路線，他分別用佛格特與布勞格這兩位人物來作為代表。   這兩個人物，前者是與被譽為「生態良知」的李奧帕德（Aldo Leopold）同時代的學界摯友，而後者則是因為推動「綠色革命」而得到諾貝爾經濟學獎的農業專家。對於人類的未來，特別是在人與自然的關係之間，前者像是先知一般不斷地提出警語，倡議要用減法的生活方式來善待自然環境，可說是當代環境主義的先驅。而有所不同的是，後者卻像是巫師大肆地推銷著科學的進步觀念，並且不斷展示像是綠色革命等傲人的農業成果。曼恩透過他優異的歷史爬梳功力，在本書中不僅展現這兩個互相鬥爭的路線其背後意識形態的差異，更重要的是有血有肉地描述了當時先知與巫師成長的時代背景和生活狀態，以及兩者短暫且實際的交鋒，讀來非常有故事情節且富饒趣味性。   其實，若深讀下去便會知道，作者並非要將先知與巫師對立。誰對誰錯不是他真正關心的事，因為他真正關心的是，人類究竟何去何從？在本書中，他用土、水、火、風來表達人類在自然中隨時遭遇在糧食、水源、能源以及氣候上的挑戰，並且讓先知與巫師的觀點在此間交織、衝突與對話。曼恩的真正用意應該更深層，用他不斷在書中引用著名的演化生物學者琳恩．馬古利斯（Lynn Margulis）的觀點來說，究竟人是否異( 或是優) 於其它生物，可以逃脫悠悠的演化長河選擇淘汰的機制呢？畢竟，不管是巫師或是先知都還是意圖改變人類命運的其中一員而已。這個發問，跳開以人為中心的思維，觸及了深層的宗教與哲學探問，亦即人在自然中的存在與位置。   此推薦文，我希望表達自己在閱讀此書上的樂趣並非只是止於書摘。第一，書中所觸及的人物，如：李奧帕德、尤金．奧登（Eugen Odum）、朱利安．赫胥黎（Julian Huxley）、卡爾．梭爾（Carl Sauer）、馬古利斯、約翰．梅納史密斯（John Maynard Smith）、恩斯特．邁爾（Ernst Mayer）等，都是我在當研究生時，閱讀生態、演化、文化地理等教科書中的理論大師。但在本書中，作者卻能把他們描述得活靈活現，讓書中主角互有交往的情節，讀來格外有趣，也很佩服。我說的有趣，是如果當時我們在閱讀這些艱深的理論時，老師們也可以還原一下這些人的時代背景，像作者一樣娓娓道來他們的八卦與故事的話，該是件多有意思的學習啊。   第二，其實本書所論及的主題正是在臺灣也爭吵不休的生態難題。原來臺灣農業的工業與化學化問題其實也跟美國的綠色革命有關，所以作者所講的歷史故事不僅僅只是發生在地球的另一端而已，它還跟我們密切有關。所以，與其一下子進入環保意識形態的價值爭辯，本書的敘事應該可以提供較軟性的脈絡與情節討論素材，畢竟人們還是喜歡聽故事，而不喜歡辯論的。   第三，臺灣的食品安全、核電、風電、水源、藻礁與氣候變遷等議題，已經嚴重到涉及公投的政治層次，但是整個社會對議題的瞭解似乎還很表面。是否背後也摻有巫師與先知的矛盾情結，或該如何抉擇，這本書的歷史故事應該提供了絕佳的反思與學習的機會。   最後，在閱讀這本帶有強烈傳記性的生態反思作品時，不知什麼原因，我的腦海中不時出現我的恩師林俊義教授所寫的自傳《活出淋漓盡致的生命》。在自傳中林老師活脫地展現出在臺灣民主轉型中，生態先知與巫師對壘的諸多情節，更有趣的是他用的教科書就是曼恩講到的一些人物，如奧登的《生態學基礎》（Fundamentals of Ecology）以及邁爾的《邁向一個新的生物學哲學》（Toward a New Philosophy of Biology）即是。我衷心地希望更多臺灣的生態人物故事也能躍然於作者的筆法與反思之中，當然更重要的是先來讀讀這些書。   ●本文摘選自 衛城出版社 所出版之八月新書《巫師與先知》推薦序。     【推薦閱讀】恐怖鬼月來臨！不可思議怪現象 👻國產恐怖片《粽邪》原著小說揭開神秘喪葬習俗👻電影《粽邪3》男演員拍戲差點和鬼變成家人的真實事件👻鬼月來臨！「願神」大人降世 黑暗獵奇的邪教儀式恐怖登場👻女兒託夢想嫁、撿紅包代表脫單成功？臺灣文化信仰反映社會問題👻台中東海大學傳說「女鬼橋」！《都市傳說事典》尋怪談真相 有故事氣候變遷衛城出版社閱讀風向球    😲 消毒耳機用紫外線燈「會壞嗎」？內行人2清潔招數不讓人生那麼累,https://reading.udn.com/read/story/122749/5649198
Udn,藻礁,20年電費全免？日本太陽能業者推「零耗能住宅」,倡議家,2021-08-05 13:18:06,Content not found,https://ubrand.udn.com/ubrand/story/12116/5652324
Udn,藻礁,全國數位閱讀探究競賽 竹縣文山國小奪1特優2佳作,文教,2021-07-29 11:32:13,新竹縣參加「110年度全國中小學數位閱讀專題探究競賽」，共獲得1特優、4佳作，其中全校僅6個班級的小校文山國小就包辦了特優及2個佳作，6年級組以「討人厭的小黑蚊」主題榮獲A組全國特優，5年級的「MINBLE小精靈」隊與「文山大玩家」隊則分別獲得A組佳作，表現相當亮眼。縣府教育處表示，數位時代來臨，教科書不再是得知識的唯一來源，為培養孩子上網搜尋資料，判斷並整合資訊，教育部國民及學前教育署與台灣閱讀文化基金會辦理此競賽，今年吸引全國國中小共715隊參與。除了文山國小獲獎外，竹東鎮中山國小及竹北市博愛國小也在175隊國小B組中獲得佳作，新竹縣共贏得1特優、4佳作，展現閱讀理解與思考探究的軟實力。文山國小校長王恭志表示，這學期受疫情影響，停課不停學變成一種全新的教學模式，但老師們都非常努力，讓學生的學習不中斷，競賽的指導老師們甚至利用課後的時間與學生相約線上會議，遠端進行探究競賽的討論，培養學生團隊合作，形成自主探究與學習的能力，讓家長都非常的感動。參加競賽的6年級學生陳姵縈說，透過這次的主題探究，才知道原來校園中擾人的小黑蚊不是蚊子，也希望把這樣的探究經驗帶到國中去，有機會繼續從事探究活動。同組的陳奕愷也說，雖然因疫情關係，研究沒辦法做到實證的階段，但是這次的分享經驗能夠傳承給學弟妹，希望他們繼續研究，嘗試解決學校小黑蚊肆虐的問題。拿到佳作的中山國小探究主題為「以臺灣便利商店與國外差異之研究－以臺、日、韓、美為例」，博愛國小則以「藻礁生態與發電需求真的只能二選一」為主題，將生活中時事巧妙入題。【文教熱話題】 ▪ 青少年的網路世界：「數位原生世代」問卷填答 快來分享你的看法！ ▪ 整理包／112年升大學分科測驗 7科完整試題與解答 ▪ 分科測驗／紅利不再！補教估台大醫284級分 缺額校系可這樣選填 ▪ 分科化學／考生嘆不易！非選題計算多 高中師指「這1題」有爭議 ▪ 分科數甲／計算量大、考斜橢圓「好生疏」 考生：很多人寫不完 ▪ 分科生物／COVID-19、猴痘時事入題 考生提早交卷：簡單 ▪ 分科歷史／中國史比重多、考白色恐怖 考生：有刷考古題能拿分 ▪ 分科公民／NCC換照、ME TOO都入題 考生作答想好久直呼「好難」 ▪ 白飯之亂 北科大挨轟「教育失敗」遭洗版剩1.5顆星 ▪ 專題／學習歷程，別鬧了！首屆108課綱生心路大公開 小黑蚊疫情新竹,https://udn.com/news/story/6898/5635476
