source,keyword,title,category,up_datetime,content,url
Udn,藻礁,從南衝到北 蘇偉碩王文心夫婦捍衛言論列車前進總統府,要聞,2022-08-28 22:02:37,無黨籍高雄市議員參選人王文心發起的捍衛言論自由列車，一連5天行腳從南台灣潮州火車站一路北上，沿途經過各縣市火車站便演講反對「數位中介服務法」，獲得不少共鳴。今天下午3時許，王文心一行人抵達總統府前，由警方安排在白色恐怖受難者紀念碑廣場集會，前來助陣的成員包含參選高雄市議員的顏坤泉、李柏融，投入台中市議員選戰的楊文元、參與桃園市中壢區市議員的毛嘉慶都到場聲援。護藻礁公投領銜人潘忠政也以個人身分到場表達反對限制言論自由的不當立法，孫文學校校長張亞中表示，執政者愈心虛愈要限制言論自由，藉此壓制反對聲音。國家通訊傳播委員會（NCC）推動「數位中介服務法」引發民眾與業者全面反彈聲浪，蔡英文總統日前以黨主席身分在民進黨中常會上重申，言論自由是憲法賦予人民的權利，捍衛言論自由，就是民進黨堅定不移的立場。針對數位中介服務法的修法，就是「歸零思考、加強溝通」，和社會各界加強溝通，凝聚共識。發起行動的王文心說，蔡英文總統宣示暫緩只是緩兵之計，加強溝通可能是以政府強大的宣傳能量輾壓民意，接下來必須有一波又一波的民間行動，否則年底選後，執政黨不再需要顧慮選票，法案一但送進立法院，屆時上街反對就來不及了。反萊劑醫師蘇偉碩的妻子王文心投入高雄市議員選戰，兩人最近發起反中介法行動，要捍衛言論自由。圖／王文心團隊提供 2022大選高雄市選舉蔡英文數位中介服務法😬 郭台銘宣布參選總統 與侯柯都「不自認是老二」未來如何整合？,https://udn.com/news/story/6656/6571029
Udn,藻礁,【詩在瘟疫蔓延時】李有成／新冠病毒徹夜未眠,生活,2022-07-27 00:00:00,"陰陽失位，寒暑錯時，是故生疫。——曹植，〈說疫氣〉▌其一：人類世新冠病毒徹夜未眠他輾轉反側，追懷往事，也曾悠遊山林冬去春來，歲月無爭萬年一瞬，在穠華綠蔭中自在徜徉。風穿過密林輕身獨舞，雨撲打枝葉沿著樹身，要教根鬚粗壯他的故事就從洪荒開始在人類世之前，群獸在時間緊閉的大門外嬉戲，蔓藤與粗壯的樹身纏綿，飛禽屏息，靜聽大門外，歷史的腳步要如何邁出，在滾動的江河中濯足然後蹣跚前進？他的故事在日昇月落中，默默等待不知如何開始，又會走向何處，這千年萬年相安無事的寂靜。▌其二：後人類世新冠病毒徹夜未眠他輾轉反側，日夜奔波屢次變身，變身即成劫難只因山林毀棄，殘存的是家園陷落的消息他在倉皇中流竄，惶惑於節氣的敗壞，細節彷如纏繞的根莖，當萬物錯位歷史要如何梳理？如何謄寫漫漶的情節？在後人類世，時間敞開記憶可以重新來過海洋、河流、濕地、藻礁，甚至卑微的黑熊、石虎、水獺、穿山甲——在平和共生的世界，讓記憶像群蝶那樣色彩斑斕，每一個色彩都繪寫著純真美麗的敘事愛，需要學習，據說這是最後的機會，雨林和冰山沙漠與草原，就這樣唱著各自的歌●附記：本詩詩題〈新冠病毒徹夜未眠〉諧仿普契尼(Giacomo Puccini, 1858-1924)最後一部歌劇《杜蘭朵》(Turandot)中的詠嘆調〈徹夜未眠〉(“Nessun Dorma”，又譯成〈公主徹夜未眠〉或〈今夜無人入睡〉)。此曲由王子卡拉夫(Calaf) 演唱，敘杜蘭朵公主命全城百姓不得入眠，拂曉之前必須為她尋得卡拉夫王子，否則只能受死。此外，本詩提到的人類世(the Anthropocene)一詞雖然用於地質學，但是從英文字根了解，實與人類活動關係密切。至於人類世始於何時，各方說法不一。較寬鬆的說法是始於一萬兩千到一萬五千年前，也就是人類學會農耕技術之時。也有謂應該始於一七八○年前後，時當瓦特(James Watt, 1736-1819) 發明蒸氣機，引發工業革命，並因此改變了人類的生產模式與社會關係。更有人認為應該始於一九四五年美國成功研發原子彈之後。不論哪一種說法，人類世顯然標誌著人類的活動對整個地球生態所造成的巨大衝擊。這些衝擊的負面影響如今已經顯而易見：大量的能源耗費，自然生態遭到破壞，氣候急驟變遷，全球暖化日趨嚴重，許多物種瀕臨絕滅，人類世界的永續發展面臨嚴酷的挑戰。病毒很可能是眾多負面影響所帶來的惡果。而在病毒肆虐之後，如何想像一個萬物共生，平和共存的後人類世的世界恐怕是無可迴避的當務之急。晚近有後人本主義(posthumanism)、地球主義(planetarianism)之類的說法，無非建立在去除人類中心論(anthropocentrism)的基礎上，相信眾生平等，地球為各種物種所共有，人類不應該獨霸地球，甚至繼續無止境地宰制其他的物種與生命。",https://udn.com/news/story/7272/6487133
Udn,藻礁,李有成／新冠病毒徹夜未眠,琅琅悅讀,2022-07-27 00:00:00,"陰陽失位，寒暑錯時，是故生疫。——曹植，〈說疫氣〉     ▌其一：人類世   新冠病毒徹夜未眠   他輾轉反側，追懷   往事，也曾悠遊山林   冬去春來，歲月無爭   萬年一瞬，在穠華綠蔭中   自在徜徉。風穿過密林   輕身獨舞，雨撲打枝葉   沿著樹身，要教根鬚粗壯   他的故事就從洪荒開始   在人類世之前，群獸在   時間緊閉的大門外   嬉戲，蔓藤與粗壯的樹身   纏綿，飛禽屏息，靜聽   大門外，歷史的腳步要如何   邁出，在滾動的江河中濯足   然後蹣跚前進？他的故事   在日昇月落中，默默等待   不知如何開始，又會走向   何處，這千年萬年   相安無事的寂靜。     ▌其二：後人類世   新冠病毒徹夜未眠   他輾轉反側，日夜奔波   屢次變身，變身即成劫難   只因山林毀棄，殘存的   是家園陷落的消息   他在倉皇中流竄，惶惑於   節氣的敗壞，細節彷如   纏繞的根莖，當萬物錯位   歷史要如何梳理？如何   謄寫漫漶的情節？   在後人類世，時間敞開   記憶可以重新來過   海洋、河流、濕地、藻礁，甚至   卑微的黑熊、石虎、水獺、   穿山甲——   在平和共生的世界，讓記憶像   群蝶   那樣色彩斑斕，每一個色彩   都繪寫著純真美麗的敘事   愛，需要學習，據說這是   最後的機會，雨林和冰山   沙漠與草原，就這樣唱著各自   的歌       ●附記：   本詩詩題〈新冠病毒徹夜未眠〉諧仿普契尼(Giacomo Puccini, 1858-1924)最後一部歌劇《杜蘭朵》(Turandot)中的詠嘆調〈徹夜未眠〉(“Nessun Dorma”，又譯成〈公主徹夜未眠〉或〈今夜無人入睡〉)。此曲由王子卡拉夫(Calaf) 演唱，敘杜蘭朵公主命全城百姓不得入眠，拂曉之前必須為她尋得卡拉夫王子，否則只能受死。   此外，本詩提到的人類世(the Anthropocene)一詞雖然用於地質學，但是從英文字根了解，實與人類活動關係密切。至於人類世始於何時，各方說法不一。較寬鬆的說法是始於一萬兩千到一萬五千年前，也就是人類學會農耕技術之時。也有謂應該始於一七八○年前後，時當瓦特(James Watt, 1736-1819) 發明蒸氣機，引發工業革命，並因此改變了人類的生產模式與社會關係。   更有人認為應該始於一九四五年美國成功研發原子彈之後。不論哪一種說法，人類世顯然標誌著人類的活動對整個地球生態所造成的巨大衝擊。這些衝擊的負面影響如今已經顯而易見：大量的能源耗費，自然生態遭到破壞，氣候急驟變遷，全球暖化日趨嚴重，許多物種瀕臨絕滅，人類世界的永續發展面臨嚴酷的挑戰。病毒很可能是眾多負面影響所帶來的惡果。而在病毒肆虐之後，如何想像一個萬物共生，平和共存的後人類世的世界恐怕是無可迴避的當務之急。   晚近有後人本主義(posthumanism)、地球主義(planetarianism)之類的說法，無非建立在去除人類中心論(anthropocentrism)的基礎上，相信眾生平等，地球為各種物種所共有，人類不應該獨霸地球，甚至繼續無止境地宰制其他的物種與生命。【推薦你閱讀】熱門話題一覽㊗️　琅琅悅讀周年慶！活動倒數計時中！✨　熱門專題【美學系列】：當蔣勳老師與星座相遇？✨　熱門專題【被遺忘的一本書】：再也沒有另一本《傷心咖啡店之歌》了✨　熱門專題【走味關係】：越式河粉的偏愛 Phoever Love🍱　獨家數位專題 作家餐桌：與20位作家一起大啖私房美食！ 詩在瘟疫蔓延時    😲 消毒耳機用紫外線燈「會壞嗎」？內行人2清潔招數不讓人生那麼累",https://reading.udn.com/read/story/7048/6487133
Udn,藻礁,國中女師飆罵「陽痿」、「硬不起來」 學生檢舉竟不懲處,文教,2022-06-21 11:19:46,高雄市鳳山區某國中科任女老師課堂上以「陽痿」、「處男」、「硬不起來」等言語罵學生，校內性平會認定構成性霸凌，但最後考核會決議不懲處。人本基金會及學者今日召開記者會指出，教育工作者以涉及性別刻板印象的不當言語傷害學生，校園性平退一大步，教育局應退回決議，並啟動調查。高市教育局回應，此案將退回學校重做適法處置。人本基金會今早在高市議會召開記者會揭發，去年11月，林姓女老師談及藻礁問題，恰巧一名男學生發出聲響，林當場失控罵「藻礁有什麼好笑的，我不管你是口交、肛交或什麼交」，另羞辱「一輩子都是處男」、「搞不好第一個陽痿的就是你」等言語，事後學生向教育部、教育局等單位投訴。人本南部辦公室主任張萍說，該校校長今年暑假即將退休，處理態度消極，校內性平會初次以「無人申請或檢舉為由」結案，後來在人本關心後才重新啟動，並認定「陽痿」、「處男」、「硬不起來」構成性霸凌，建議給予老師一支申誡，不過林師以傷害自身及揚言提告職場霸凌進行情緒勒索，考核會決議「不懲處」。高雄醫學大學性別研究所長胡郁盈分析說，國中學生正處於發展性別認同的時期，老師不該以涉及性別刻板印象的言語來攻擊或傷害，可能產生或轉化成暴力、傷人等舉動，造成非常不當影響。律師張銘峰也認為，性平會已經決議老師應該給予申誡處分，考核會若要推翻決論應該要有具體理由，呼籲教育局重新考量。高市教育局回應，此案學校已依法完成調查，經調查教師性霸凌成立，並依性別平等教育法第25條規定移送教師成績考核委員會審議，有關不予懲處處分，教育局重申對校園性別事件的重視，將退請學校予以適法之處置。人本基金會今日在高市議會召開記者會，揭發鳳山區某國中女老師在課堂上言語性霸凌學生。記者徐白櫻／攝影【文教熱話題】 ▪ 青少年的網路世界：「數位原生世代」問卷填答 快來分享你的看法！ ▪ 整理包／112年升大學分科測驗 7科完整試題與解答 ▪ 分科測驗／紅利不再！補教估台大醫284級分 缺額校系可這樣選填 ▪ 分科化學／考生嘆不易！非選題計算多 高中師指「這1題」有爭議 ▪ 分科數甲／計算量大、考斜橢圓「好生疏」 考生：很多人寫不完 ▪ 分科生物／COVID-19、猴痘時事入題 考生提早交卷：簡單 ▪ 分科歷史／中國史比重多、考白色恐怖 考生：有刷考古題能拿分 ▪ 分科公民／NCC換照、ME TOO都入題 考生作答想好久直呼「好難」 ▪ 白飯之亂 北科大挨轟「教育失敗」遭洗版剩1.5顆星 ▪ 專題／學習歷程，別鬧了！首屆108課綱生心路大公開 霸凌,https://udn.com/news/story/6898/6403588
Udn,藻礁,桃園棲地小燕鷗減少 草漯沙丘0隻,生活,2022-06-21 02:19:08,二級保育鳥類小燕鷗，每年4月中旬陸續飛抵台灣海岸育雛。桃園市野鳥學會昨發布今年調查結果，草漯沙丘「1隻不剩」，白玉沙灘、大潭藻礁G1及G2區的成鳥及雛幼鳥數量也不如以往，凸顯棲地減少的隱憂；不過，竹圍漁港數量增加不少，已成重要繁殖地。桃園市野鳥學會調查發現，桃園首座地質公園內的草漯沙丘，去年有105隻小燕鷗成鳥，疑因大潮沖掉鳥巢，導致今年小燕鷗不再利用此區繁殖，數量為零，減少最多；白玉沙灘、大潭藻礁G1和G2區也僅剩個位數。理事長劉義仁推測，包括淨灘、浪犬入侵、天敵、人車干擾、惡劣氣候、風沙侵襲及適合繁殖地域不足等因素，都影響小燕鷗繁殖。鳥會呼籲各界關懷環境生態。劉義仁說，雛幼鳥保護色佳，善於躲避天敵，親鳥餵食才現身，調查時不易發現，因此雛幼鳥數量會明顯低估，族群總數也會低估。另，去年7月中調查，小燕鷗多已孵化，甚至南返，因此今年提早3周進行，差異在巢數會較多，雛幼鳥數會較少，因為有些尚未孵化。桃園市野鳥學會今年動員40位義工，調查39公里海岸線小燕鷗生態，共發現成鳥168隻、雛幼鳥43隻及孵化中巢數29個，和去年調查相比，成鳥減少40隻、雛幼鳥增加8隻、巢數增加10個。大園區竹圍漁港則有129隻成鳥、41隻雛幼鳥。 桃園大潭藻礁沙灘想看可愛萌寵、寵物健康保健資訊、教養方法、帶牠們去哪吃喝玩樂，快來加入寵物部落粉絲團！點我前往：https://www.facebook.com/udnpet,https://udn.com/news/story/7470/6402718
Udn,藻礁,沙丘、藻礁和風稜石　 暢遊石門「老梅綠石槽」等風景名勝，讓人心曠神怡,旅遊,2022-06-10 21:01:02,"2022/04/10 週日《暢遊石門風景名勝：石門婚紗廣場→富基漁港→富貴角燈塔→富貴角公園→老梅綠石槽》行程：石門婚紗廣場→富基漁港→富貴角燈塔→老梅迷宮→風剪樹區→富貴角公園→老梅沙灘→老梅綠石槽→富基漁港→石門婚紗廣場→劉家肉粽→賦歸。(步行時間含休息 09：00~11：51, 共2小時51分, 2.6公里)多年以來, 一直期盼著, 有朝一日能夠親睹老梅綠石槽的奇特景象. 4月10日終於得償夙願, 跟隨登山會暢遊石門地區的風景名勝.早上 08：45 開車駛抵石門婚紗廣場, 只見隊友們開心地在各處景點拍照. 9點時間一到, 隊長召集隊友們集合團拍後出發. 我們沿著海岸線漫步, 碧海藍天、 海闊天空輝映著岸邊的海灣、沙丘、藻礁和風稜石, 讓人心曠神怡. 遙望富基漁港一片獨特的建築物外觀, 屋頂上有著一根根色彩鮮豔繽紛長長的看似煙囪、又像瓶身、又像跳棋棋子的造景, 上網查詢這些屋頂是50頂「墨西哥帽」造型的鋼構建築, 這是透過國際競圖榮獲首獎的西班牙建築師文森．瓜雅（Vincente Guallart）的設計, 美侖美奐.繼續沿著步道拾級而上來到已有百餘年歷史、黑白相間、臺灣本島最北端的富貴角燈塔, 在觀景平臺上可以眺望優美迷人的北海岸風光. 接著前往紅磚打造、高出頭頂的老梅迷宮, 穿梭其中彷彿回到孩提時期的捉迷藏, 赤子之心油然而生. 賡續循著指標遊覽富貴角公園內十幾棵被強風雕塑而成的榕樹風剪樹區, 有些身手矯健的隊友爬到樹上拍照, 童心未泯, 令人莞爾.最後是今天的重頭戲：老梅綠石槽, 每年二至四月退潮期間才會在老梅沙灘出現的特殊景觀, 四月清明時節最為美麗絕倫. 由於大片海藻附著在石槽上, 放眼望去, 綠意盎然, 故名為「綠石槽」.“石槽是地質名詞, 老梅石槽同時擁有細緻沙灘與被侵蝕的火山岩岩岸, 適合海藻類附著生長, 海藻死去後, 殘骸硬化成一層薄薄的石灰質, 新的藻類就在這層石灰質上繼續附著生長, 如此不停地循環堆疊出這美麗的藻礁.”我們徜徉於這片造物者賜與的天然美景, 海風吹拂, 海浪翻騰, 直叫人樂以忘憂, 久久不忍離去.無奈終須一別, 踏上歸途時仍頻頻回望那片療癒人心的綠石槽, 只能在心中默許來年再相見. 回程再到「劉家肉粽」買些美味的肉粽好讓兒子們打打牙祭.下文節錄自［健行筆記］：* 富貴角：早期住在此地的平埔族人稱此地為「打濱」或「打鞭」，為海岬之意。清乾隆27年（西元1762年），荷蘭人法倫泰在其著作《新舊印度誌》中，將富貴角記為「hoek」，也是「海岬」的意思，後人便採其譯音稱此地為「富基角」，直到日治時期才更名為「富貴角」。富貴角因地質景觀十分特殊，獲林務局遴選為臺灣百大地景之一。* 富貴角燈塔：原稱富基角燈塔，日本佔領臺灣後，為建設台日兩地之間的海底電纜及航路標識，於西元1896年著手興建，次年建造完成，塔身為八角形鐵造，外漆黑白色平行相間條紋，由於秋冬常出現濃霧，塔內還裝設了霧笛。民國十六年改名為富貴角燈塔，二次大戰時被炸受損而拆除，民國五十一年改建為八角形混凝土塔，仍漆成黑白色平行相間條紋，塔高14.3公尺，照射遠及19海浬。百年來矗立於最北端的富貴角燈塔，已成為北臺灣海岸重要且獨樹一格的地標。石門婚紗廣場：藻礁：看海的日子：富基漁港：富基漁港的「50頂墨西哥帽」：富貴角燈塔步道：風稜石：富貴角燈塔：灣塔自行車道路線圖：(台灣本島最北燈塔) 富貴角燈塔 簡介：交通部航港局 富貴角燈塔：由富貴角燈塔觀景平臺眺望美景：風稜石：遠眺老梅沙灘：老梅沙灘：綠色礁岩海岸：老梅海岸 - 特殊景觀「石槽」：老梅迷宮：富貴角觀景平臺：富貴角公園的榕樹風剪樹區：老梅綠石槽：離開老梅沙灘：回首來時路：富貴角燈塔、臺灣百合：風稜石：富貴角燈塔：#健行筆記app更多相片另存於相簿：https://hiking.biji.co/index.php?q=album&act=photo_list&album_id=38732 公園步道墨西哥55Playback speed1x NormalBack0.25x0.5x1x Normal1.5x2x00:00/07:44SkipAds by 😲 消毒耳機用紫外線燈「會壞嗎」？內行人2清潔招數不讓人生那麼累",https://udn.com/news/story/12395/6263515
Udn,藻礁,桃園／台灣最美的公路！暢遊「台61線」西部濱海快速公路、「永安觀光漁港、海螺文化園區」,U值媒體,2022-06-09 09:40:00,Content not found,https://udn.com/umedia/story/12749/6356158
Udn,藻礁,一覽北海岸美景！ 新北絕美看海秘境「麟山鼻木棧道」 高CP值環狀海景步道,旅遊,2022-05-19 10:01:44,udn走跳旅遊／大海愛上藍天北海岸最推薦濱海步道非麟山鼻木棧道莫屬，這條步道平緩好走，可同時欣賞海岸、沙灘、樹林、藻礁、風稜石等，還可以玩沙、玩水、野餐等適合全家大小一起健行遊玩，沿途有綠蔭遮蔽，全長約1.4公里，來回步行約20分鐘，為北海岸CP值高海景步道。 麟山鼻木棧道規劃完善，步道平緩好走，就算是推車也可以前往。前方就是一望無際的大海，還有一整片的白沙，海景第一排最佳看海區。 噓！不能說的秘密！麟山鼻木棧道為北海岸最佳的玩水秘境沙灘。入口就是麟山鼻漁港，這條同時也是麟山鼻自行車道。沿途步道平緩好走，綠蔭遮蔽，適合全家大小一起健行～步道旁有許多缺口可以下去，可直接通往沙灘、大海，近距離接觸海水～到處都是最美的景觀座位。還有藻礁可以欣賞，季節限定之美～超美的海景步道，聽說最美的時刻就是夕陽西下時，美的讓人沈醉、驚豔。海天一色，美如仙境。如果能再增加一些座椅或涼亭那就更完美了～麟山鼻木棧道新北市石門區德茂里文章來源：大海愛上藍天旅遊日記分享  FB：大海愛上藍天想知道更多旅遊美食資訊，請追蹤按讚「udn走跳世界」 步道秘境CP值野餐大台北旅遊海灘55Playback speed1x NormalBack0.25x0.5x1x Normal1.5x2x00:00/07:44SkipAds by 😲 消毒耳機用紫外線燈「會壞嗎」？內行人2清潔招數不讓人生那麼累,https://udn.com/news/story/7205/6281077
