source,keyword,title,category,up_datetime,content,url
Udn,藻礁,能源政策不檢討 天然氣接收站之亂還會繼續下去,要聞,2023-02-02 14:48:40,基隆第四天然氣接收站的興建爭議，中央打算以沒收地方公投的方式為四接興建掃除障礙。從前幾年的桃園第三天然氣接收站的藻礁爭議，到四接影響基隆港航運與當地生態，接收站之亂不會只有這兩件，之後在台中、雲林與高雄的三座接收站，類似戲碼會持續上演，關鍵在蔡政府的能源政策有問題。登入看完整精彩內容！增值你的國際新知8/31前訂閱年方案 抽iPad Air登入閱讀還不是會員？ 馬上註冊訂閱看完整精彩內容增值你的國際新知8/31前訂閱年方案 抽iPad Air登入閱讀還不是會員？ 馬上註冊 ｜ 立即搶購訂閱看完整精彩內容增值你的國際新知8/31前訂閱年方案 抽iPad Air訂閱支持 天然氣電價蔡政府基隆港生活 王茂臻新聞網總編輯謝長廷的狂言與蔡政府的默許蔡政府對陸客的欲拒還迎 是為一黨之私 置國家利益不顧,https://udn.com/news/story/122542/6944635
Udn,藻礁,基隆戰四接／學者：地方自治只能靠中央施捨,要聞,2023-02-02 03:07:40,內政部以「非地方自治事項」駁回基隆市民發起的護海公投提案，政治大學法律系副教授廖元豪表示，內政部用憲法「電政」、「海洋漁業」為由，來阻擋這個公投，實在很勉強，照這樣的解釋方法，中央權限幾乎無邊無際，地方自治只能在中央施捨情況下，才有機會。廖元豪表示，公投法廿六條規定，直轄市、縣市政府對公民投票提案，是否屬地方自治事項有疑義時，應報請行政院認定。不過，「正常情況下，市長不會攔阻市民的意願。」公投是否能舉行，可由中選會去決定。內政部引據電業法和憲法，強調「電政」是中央主管權限，廖元豪認為，內政部解釋，法理上其實沒那麼「絕對有理」，憲法所指「電政」，應是指基本電力能源政策，例如，核四廠要不要蓋，而不能說只要跟「電」有關聯，就統統是中央專屬權限，難道中央所設的電廠、電力公司，有就業歧視、違反空汙法問題，地方勞動局或環保局不能調查裁罰嗎？廖元豪也指出，內政部引用行政法院判決核四公投提案，與基隆護海公投提案不同。因核四廠本就是中央政府的設施，地方不能干預，可以理解，可是基隆護海公投提案並不是要干預既有的中央政府設施如何運作。內政部指藻礁公投是逕行提案全國性公投成案。廖元豪說，這也可解釋為地方與中央有重疊性，公投由中央或地方辦理均可。尤其基隆護海公投是「填海造地」，「除非那兒都沒基隆土地，否則要說純屬中央，也有點牽強。」 公投內政部基隆😬 郭台銘宣布參選總統 與侯柯都「不自認是老二」未來如何整合？,https://udn.com/news/story/122542/6943242
Udn,藻礁,內政部駁回四接地方公投連署 謝國樑：再協助找一條路,要聞,2023-02-01 14:21:05,民主全球論壇共同發起人考夫曼今天拜會基隆市長謝國樑，謝國樑表示，地方發起的四接公投雖然連署成功，但被內政部駁回，理由「不屬於地方自治事項」，會再和公投團體、學者專家討論，透過重新規畫找出一條路讓民眾來公投，能源和環境的平衡，基隆市民絕對有資格表達意見。考夫曼表示，世界各國來講，中央與地方意見不同是很正常，建議可以在文字上修正、思索，要讓人民有直接民主參與的機會，是民主自由的真諦。雙方也針對四接公投案討論，謝國樑表示，地方四接公投雖然連署成功，但被中央政府駁回，理由是不屬於地方自治事項，但他認為，能源和環境的平衡，基隆市民絕對有能力、有資格表達意見，他會去思考如何解套，讓市民有表達意見的權益。謝國樑說，但倒也不用說表達抗議，本來就會鼓勵公投團體和市政府繼續努力，他身為基隆市長必須表達這一點，鼓勵民眾進行地方性公投，不會阻擋。謝國樑表示，如果是因為技術性的問題無法來完成，可以參考其建議，重新架構文字、內容，透過重新規畫讓民眾有機會來公投，找出一條路讓民眾來公投，會再和公投團體、學者專家討論。中央政府推動基隆協和發電廠由燃油轉型為燃氣組，要興建「四接」，後來提出東移方案，基隆地方人士發動公投，要求基隆市府拒絕填海造陸方案。地方反對填海造陸人士組成守護外木山行動小組，發起護海公投，有超過法定提案門檻兩倍的2475人連署。提案人送件後，市府要求補正資料，基隆市政府陳報行政院認定是否屬地方自治事項。根據內政部近日回覆基隆市政府，指依憲法電政為中央立法並執行之事項；依電業法電業擴建之許可及核准也由中央主管機關指定電業管制機關辦理。內政部表示，此公民投票案涉及台電公司協和電廠更新改建計畫（含接收站）能否執行，除了電業之擴建依電業法規定屬中央主管機關權限外，亦影響我國整體電力供應、能源儲備、產業關聯 電政事宜，所以屬中央專屬事項。內政部並說，另依商港法，協和電廠更新改建計畫擬填海造陸區域，納入基隆國際商港港區範圍，該區管理及區域內設施之核准屬交通部權限，非地方自治事項。內政部並舉民國102年「你是否同意新北市台電公司核能四廠進行裝填核然料棒試運轉？」一案為例，台北高等法院判決認定非屬地方自治事項確定。另民國109年「您是否同意中油第三天然氣接收站離桃園大潭藻礁海岸及海域？」逕行提案辦理全國性公民投票並成案，內政部說明，是參照過往司法判決及公民投票實務，認定四接公投案非屬地方自治事項。民主全球論壇共同發起人考夫曼今天拜會基隆市長謝國樑。記者游明煌／攝影 😮 行動電源充電時爆炸！台電提「3不3要」充電守則 照著做就安心,https://udn.com/news/story/122542/6941800
Udn,藻礁,聯合報社論／民進黨把社會的中間地帶變窄了！,評論,2023-01-26 00:09:30,民進黨敗選屆滿兩個月，年前蘇貞昌率內閣總辭，新閣迄無影蹤；全民在政府「看守」狀態下度過春節，感覺相當詭異。近期傳出的內閣人事，包括陳建仁、蘇嘉全、鄭文燦、林佳龍等的安排，無非都出於黨內派系勢力平衡或中生代接班之考量，乃至維持府院黨的三角關係以確保蔡總統不致過早跛腳。看來，經過這些年呼風喚雨的治理，蔡總統的視野已跨不出民進黨的既得利益範圍，很難再有國家社會長遠發展的宏圖。蔡英文執政的七年，民進黨首度締造了完全執政，同時掌握行政部門與立法部門的主導權。如此優越的條件，民進黨原本有絕佳的機會為台灣打造一個更公義、更開闊、更文明的社會；誰料，它卻一頭栽入權力的迷思，變成一個以追逐權與利為滿足的政黨，也失去了自己在野時有過的理想與追求。外界屢批評民進黨是「雙標黨」，原因在此。對內，它退化成像威權年代國民黨那樣的「一言堂」，立法部門變成府院的橡皮圖章；當「最高民意機關」也失去反映民意的功能，民進黨距離社會民意當然愈來愈遠。對外，它假藉「轉型正義」之名不斷對國民黨施行羞辱和報復、沒收財產、削減軍公教年金、挑起族群情結；另一方面，它豢養側翼網軍壓制社會異議、關閉電視台，並利用資源分配大權在藍綠執政縣市製造政績差異。蔡政府執政期間，「黨」和「國」與「政」的分際線幾乎消失殆盡，國家資源不斷被用來壯大民進黨，毫不遮掩。在這種情況下，除在野黨遭到箝制打壓、民眾遭到恐嚇，社會被撕裂成非藍即綠，中間地帶幾乎消失殆盡。最明顯的現象是，原本活躍的台灣各項社會運動，隨著民進黨執政許多社運人士被延攬入閣為官，社運便一路迷向乃至消沉。例如，出身農陣的陳吉仲當上農委會主委，不斷使用補貼政策來掩飾農業失政；他甚至不惜出賣水利會使之收歸國有，讓農民原有的主導權被收繳到官僚手中。農田、漁塭遭到光電產業入侵，農漁民飽受欺壓卻無處申訴；就如桃園藻礁因中油興建三接而破壞，即使全民公投支持護藻礁，蔡政府卻依舊蠻幹。民進黨不把環境保護放在心上，不把民意放在眼裡，卻一味盲目力挺蔡英文錯誤的能源政策；如此背信忘義的政黨，怎麼可能贏得選民支持？這次選舉大敗，是全民對蔡政府執政釋出極度不滿的清晰訊息。如果是一個神經敏銳的主政者，第一時間即應迅即調整自己的作為與路線，包括調整自己的執政團隊。但蔡總統卻在第一時間慰留蘇內閣，明顯誤判了民意；幾經周折，在蘇貞昌終於向民怨稱臣請辭後，蔡總統的接班團隊名單仍在她的小圈圈中打轉，尤其要阻擋兼任黨主席的賴清德的政治影響力坐大。這樣的心態與氣度，恐怕沒有太多值得期待。陳水扁首度執政時曾打出「全民政府」的訴求，任命國民黨的唐飛為閣揆；李登輝則曾任命郝柏村為行政院長。兩次雖不是愉快收場，卻是為了鞏固政權、展示執政者的心胸寬宏而發，具有宣示作用。對蔡英文目前的處境而言，就算她無意從在野黨延攬人才，國內也還有許多器識寬廣、才幹卓絕的社會賢達人士可以為國做事；遺憾的是，在她的視野中，卻從來沒有這些人存在的位置。這是蔡總統的識人拘限，還是民進黨的排外性格使然？蔡政府執政七年，除了藍綠對峙更為激烈，社會的中間地帶也變得愈發狹窄。台灣整體社會力遭侵蝕衰敗，民進黨該當首責。 民進黨蔡英文內閣😬 郭台銘宣布參選總統 與侯柯都「不自認是老二」未來如何整合？,https://udn.com/news/story/7338/6930087
Udn,藻礁,兔年救國企 先解決能源危機,評論,2023-01-20 02:25:17,新的一年，無疑是台灣經濟、社會及環境能否轉向永續，讓百姓安居樂業的關鍵年。然而，從國營企業現狀和重大施政看，台灣正朝向難以國泰民安的不永續加速前進。此時，政府今年度總預算當中，卻以「強化經濟與社會韌性」為名，加撥一千億特別預算。這兩年台電與中油虧損嚴重，另一家台船也虧，營利「商機」幾全賴國艦國造和離岸風電業務。不僅如此，接下來核二、核三廠即將因陸續停機減半，形成供電大缺口。同時，從桃園大潭電廠第三接氣站犧牲藻礁，到協和電廠「四接」犧牲海岸生態和基隆港營運功能，到高雄大林浦「七接」抗爭，顯示花大錢的填海造陸規畫，是陷台灣於能源危機根源。其中協和電廠從燒油改燒氣，無疑是接下來能源轉型跳票多嚴重的關鍵。日前身兼台電董事長的經濟部次長曾文生，以去年基隆大缺水，解釋協和電廠填海造陸建「四接」的必要性：「因為沒電從貢寮抽水給基隆人喝，所以就缺水了」。輕視基隆人智慧的「反推銷」，恐怕只會讓協和油轉氣，更趨延宕。另方面，台灣所需天然氣，幾全賴租船運送進口。然而，政府因應龐大需求實際做的，卻只在去年元月由交通部研議、鼓勵航商建造液化天然氣（ＬＮＧ）運送船，至於要找誰造船，卻未提及。照說，既然要建國家船隊，經濟部早該指示台船擬妥全盤規畫。然而，從台船造船訂單看，其建造能力，卻亟待挽救。如今亡羊補牢，著手規畫學造ＬＮＧ船，正可望同時為台船、台電及中油帶來轉機。台船投入建造ＬＮＧ船，可從較小的加氣駁船著手，同時著眼於改裝現成船，成浮動接氣站。如此可滿足未來各燃氣電廠所需，同時從中吸收、建立相關技術。原本設基隆廠的「潛艦產業園區」，正可配合協和電廠轉型，成「ＬＮＧ船產業園區」。展望兔年，為讓協和電廠成功救援台灣缺電，政府須及早善用其間相互依存與共榮關係。眼前「強化韌性」該做的第一件事，便是針對協和電廠，捨棄填海造陸規畫，利用既有廠區建接氣站，加速「第一階段油轉氣」。 協和電廠基隆港😬 郭台銘宣布參選總統 與侯柯都「不自認是老二」未來如何整合？,https://udn.com/news/story/7339/6923756
Udn,藻礁,聯合報社論／說好的美麗島，你卻要在自己土地上布雷,評論,2023-01-19 00:04:17,自從閣揆蘇貞昌宣示要「掃帚抗敵」，蔡政府的反中民粹即越來越荒腔走板。最近，美國批准售台價值五十五億元的十四套「火山布雷系統」，能以十分鐘九六○枚的速度在台灣沙灘上部署反裝甲地雷，阻擋敵軍攻勢。這項採購引發各界強烈質疑：蔡政府在自己的國土上布雷，是要玉石俱焚，把台灣變成烏克蘭嗎？幾十年來，民進黨把「美麗島」的口號喊得震天價響，聲稱這個「本土政黨」如何愛鄉、愛土、愛人民。到頭來，蔡政府為了自己失控的兩岸政策，卻甘願充當美國的馬前卒，不惜焦土作戰，把鄉土、百姓全都賠上。試想，當這套系統派上用場時，就算台灣一天內能把重要灘頭布滿地雷，美麗之島也已柔腸寸斷，經濟活動全告停頓，「福爾摩沙」將變成什麼模樣？替這套布雷系統辯護的人振振有詞，包括：第一，它布的是「戰防雷」，在確定或預判敵軍登陸地點後才精準部署，不會在平時廣泛大面積布雷；第二，其設計針對的是敵人裝甲車，而非人員，通常需要一五○公斤的壓力才能引爆，我國人民不會因誤觸而引爆；第三，這種地雷浮布於地面，易於識別及回收，也能透過系統啟動其「自毀功能」。言下之意，這種地雷既「安全」又「智慧」。然而，上述的說法其實漏洞甚多，輕易便能駁斥。第一，兩岸戰爭到了我方需要布設戰防雷時，意味海戰空戰均告失利，要進入地面肉搏戰；以台灣蕞爾小島，能有烏克蘭那樣的長期陸戰縱深嗎？第二，戰防雷雖是針對裝甲車而來，但攜帶器械或奔跳中的人員都可能造成一五○公斤以上的壓力，而引爆地雷。何況，浮布灘頭的地雷可能隨潮水漂移至其他海岸，能說不危險嗎？第三，該地雷雖有自毀功能，但根據國外軍事機構測試，約有百分之五到百分之十的地雷因各種因素無法完全自毀，其遺禍仍相當可怕。要不要購置這套布雷系統，軍方當然可以有其特殊的戰略構想，藉以表達軍民共同浴血抗戰的決心。但讓人困惑的是，主政者為何不好好珍惜既有的和平與繁榮，卻天天想著戰爭？一個在野時曾把「美麗島」歌頌上天的政黨，一朝執政後，卻甘願把自己的國土鋪上地雷，這算哪門子「愛鄉土」？請蔡政府誠實告訴人民：全球有哪個民主國家把地雷布設在本國土地上？何況，就算這些地雷能夠自毀，它炸毀的不是台灣的土地嗎？諷刺的是，當「美麗島系」消失在民進黨的現存派系表列，民進黨連「美麗島」三個字也漸漸不再提及了。近幾年，蔡政府不惜毀掉大潭藻礁也要強建中油第三天然氣接收站，不惜填海毀基隆港也要建「四接」，人們便知道這個本土政黨已經徹底變質，環境保護已從它的理念中消失無蹤。不僅如此，不惜毀掉農田、填掉埤塘也要種光電，不惜砍掉樹林也要改鋪太陽能板，不惜擋住漁民航道也要開闢離岸風電場。蔡總統為了維護自己的能源政策，國土都可以濫建濫伐；以這樣的執政思維，如今為了扮演美國馬前卒，在自己的海岸線上布雷，也不曾有過任何猶豫吧！地雷因易於造成不特定對象的傷亡，且遺害久遠，被視為「不道德武器」，被《渥太華公約》列入禁用範圍。荒謬的是，蔡政府卻一味宣傳火山布雷系統的「進步性」，彷彿這種地雷能辨識敵友，絕不會誤傷人民。這放在軍紀事件頻傳，連雄三飛彈都能誤觸發射的軍伍中，叫民眾如何信服？連海灘都敢出賣，蔡政府眼中還有珍貴的東西嗎？ 布雷系統民進黨美國😮 行動電源充電時爆炸！台電提「3不3要」充電守則 照著做就安心,https://udn.com/news/story/7338/6921343
Udn,藻礁,桃市府創新提案13件獲獎 鄭文燦：提升服務品質,地方,2022-12-21 20:50:39,桃園市長鄭文燦今天上午主持市政會議，表揚市府「111年創新提案」獲獎局處時表示，今年共徵得58件提案，經初審及複審選出環保局「後湖逐浪天梯計畫」、資科局「紅利桃子」、水務局「下水道管理收費一把罩」、青年局「Youth Dream Life－桃園創新『校園雲社團』永續智慧城」、水務局「線上估驗、快速方便」等5名創新獎及8名點子獎，共計13件獲獎。鄭文燦表示，環保局「後湖逐浪天梯計畫」範圍從藻礁區到永安漁港約2公里，市府成功爭取中油及台電的支持，總工程經費約2億元，將利用潮差打造全國首座發聲海堤，並降低海堤高度，使民眾得以親近海洋，同時運用海廢建材、復育藻礁生態環境，活絡地方休閒產業，建立永安漁港北岸新地標。鄭文燦說，「後湖逐浪天梯計畫」的概念及名稱是他發想的，環保局及海管處積極推動，讓計畫落實為有特色的公共建設，目前即將進入設計發包程序，期待未來順利完成。鄭文燦指出，他擔任市長桃園市民卡發行量達180萬張，是全國唯一成功的市民卡，並成為各縣市模仿的典範，今年創新轉型，由資科局推動「紅利桃子」，透過市府宣導（發點）、商家振興（獲點）、民眾參與受惠（折點）3方互動，促進數位經濟，總計已有1400個店家參與、30萬人登記APP。鄭文燦說，水務局「下水道管理收費一把罩」，將廠商名單系統化與造冊列管，並透過資訊系統管理及IoT物聯網技術，達到科技執法與管理智慧化的目標；另水務局「線上估驗、快速方便」，將雲端技術帶入公共工程估驗付款作業，減少紙張使用，並利用大數據分析，提升預算執行效率。疫情期間，青年局推動「Youth Dream Life－桃園創新『校園雲社團』永續智慧城」，利用雲端及遠端技術帶入公共服務，滿足青年學子對校園社團活動的需求，提案已落實執行，110年「校園雲社團」FB觸及人數超過341萬次、IG也超過111萬次。 鄭文燦桃園市長青年😬 郭台銘宣布參選總統 與侯柯都「不自認是老二」未來如何整合？,https://udn.com/news/story/7324/6855759
Udn,藻礁,桃園防波堤崩壞挨批 新護岸發包中,地方,2022-12-03 02:55:45,桃園市觀音區及新屋區沿海的防波堤，近日被民眾發現受損嚴重，且其中填充不少營建廢棄物，民代質疑是「水岸豆腐渣工程」，恐影響附近居民安全。桃園市環保局回應，該防波堤已搭建逾20年，推測是年久失修加上天災所致，現場已放置消波塊，避免海岸遭海浪侵蝕，明年1月「後湖逐浪天梯計畫」也將在當地動工，呈現嶄新風貌。桃園市新屋及觀音區海岸侵蝕問題嚴峻，近期有民眾發現藻礁路上的防波堤嚴重破損，整個堤防的混凝土流失，露出大面積破洞，隨處還可見大大小小的碎石和泥土，卻不見相關單位修復，讓當地居民看了膽戰心驚，擔心會出現潰堤危機。議員詹江村表示，從民眾提供畫面來看，該防波堤的混凝土厚度和鋼筋不足，防波堤裡甚至被填入許多營建廢棄物，而不是用混凝土充實，難怪海水一來，路基就被淘空，周圍的柏油路也被侵蝕，出現路面龜裂、凹陷、鋪面剝落等情形；究竟是設計問題還是偷工減料，必須要拿出當初的設計圖，才能釐清廠商有無按圖施工。環保局表示，經查藻礁路海岸保護工程，是2000年代桃園升格前由新屋鄉公所修築，至今已時隔超過20年，多年前就有部分區域崩壞，推測是因天災導致。環保局表示，海岸管理處已在現場放置消波塊，避免海岸被海浪侵蝕，當地也規畫「後湖逐浪天梯計畫」，總工程費約1億9千萬元，將打造1條長約2公里的天然拋石護岸，目前正辦理發包作業，預計明年1月動工。環保局指出，「後湖逐浪天梯計畫」將改善新屋區後湖溪旁約2公里長退縮海岸，沿著永安漁港至觀新藻礁區，設置可聆聽海潮聲的護岸海堤，除可防止海岸繼續被侵蝕，也能成為生態旅遊的新亮點。 桃園藻礁😬 郭台銘宣布參選總統 與侯柯都「不自認是老二」未來如何整合？,https://udn.com/news/story/7324/6811126
Udn,藻礁,桃園環境教育 全國第一,要聞,2022-11-29 13:35:00,里山里海生態廊道  全方位紮根環境教育桃園環境教育再創佳績！日前「碳索生活館」獲得今年度（111）環保署環教場所認證優異殊榮，而境內 13個鄉鎮，從城市到鄉村，從海線到山上，共有31處環境教育設施場所，數量質量均高居全國第一！桃園環教設施場所30再加1多元化場域跨足12行政區。 圖／桃園市政府環境保護局提供桃園近年來致力轉型為環保產業城市，不但設定朝2050淨碳邁進，也多面向推行環境教育，讓「綠色生活」的觀念向下紮根。在 31處的環教場所，是以「里山里海生態廊道」的概念發展為主軸，包涵了海線上的濕地沙丘、藻礁石滬，到山線裡的溪流河階台地、水庫埤塘，再到防災、教育、人文等等，都是發展的主題，甚至還有垃圾掩埋場轉型的全台第一座藻礁生態環境教室-「觀新藻礁」也在去年獲得認證！「桃園是工業密度相高，因此更需要環境永續。」桃園市長鄭文燦表示，「我們要讓環境是桃園資產而不是負債，所以包括了永續環境、循環經濟等等，都是我們發展的目標和特色，而環境教育場所的設置，則是可以讓民眾透過休憩的方式，學習並落實正確的環保觀念及作為。」正是因為這樣的想法，因此桃園市推行環教場所不遺餘力，並領先全國超過 30處以上的環教場所認證，「這是一個十分重要的里程碑！」這31處的環教場面向多元，主要是市府積極鼓勵轄內公、私單位，運用現有空間，結合自身環境特色，推動環境教育場域認證，同時委託在地社區團體經營管理，鼓勵社區居民共同參與創造具有特色的在地文化，包括了觀新藻礁-永興社區、牽罟文化館-海客發展協會、許厝港重要溼地(國家級)-大園環保協會等等，都是以夥伴關係共同經營與串聯，例如今年第八屆國教獎民營事業組特優，還有團體組優等的台灣濕地復育協會，都是推展環教、產業永續發展的具體案例。「透過環境體驗，來親近跟感受桃園獨特的自然環境與人文，是教育民眾最快最有效的方式。」鄭文燦指出，法條法規是屬於約束管理的層面，但如果沒有獲得民眾理解與支持，一切都是白費，而教育更要從小開始，所以除了鼓勵民間企業併進外，也著重於幼兒環境教育的推廣，例如新屋環境教育園區，便打造出適合「全齡共享」的自然環境教育場所，讓幼兒可以扮演小農夫，觀察餐桌上的蔬菜原貌；或讓孩子們可以在沙坑體驗淨灘，瞭解海洋面臨垃圾危機，以及正確的處理方式等等。課程透過觀察生物，了解生物多樣性的重要性，並討論其面臨的危機。 圖／桃園市政府環境保護局提供桃園市政府-營造淨灘氛圍，強調乾淨的海洋需要你我共同來維護。 圖／桃園市政府環境保護局提供桃園市政府-推廣食農教育帶幼童認識及親手摘蔬菜，寓教於樂的最佳方式。 圖／桃園市政府環境保護局提供目前桃園海岸4大生態亮點、5大環境教育場域已成為環教場所，包括：觀新藻礁、許厝港重要濕地、草漯沙丘、新屋石滬、海洋客家牽罟文化館。同時，市府也正在推動後湖溪泛舟、興建兼具保護海岸與景觀旅遊效果的逐浪天梯，去年設立的「里海學堂」，則注重培育種子教師及海岸生態解說員，希望民眾在旅遊之餘，能對於桃園生態有更深一層的認識。桃園市環教場所橫跨各領域，大小朋友一起體驗先民友善捕魚的智慧。 圖／桃園市政府環境保護局提供桃園市政府環境保護局 廣告 😬 郭台銘宣布參選總統 與侯柯都「不自認是老二」未來如何整合？,https://udn.com/news/story/7314/6798536
